{
  "scenario_id": "demo-conversation-grasp",
  "run_id": "lane1-smoke-001",
  "attempt_index": 1,
  "T_start": "2026-04-16T03:34:16+00:00",
  "T_decision": "2026-04-16T03:34:17.200000+00:00",
  "T_exec": "2026-04-16T03:34:21.600000+00:00",
  "decision_latency_ms": 1200,
  "exec_latency_ms": 5600,
  "within_threshold": true
}
