{
  "scenario_id": "demo-dangerous-action",
  "run_id": "smoke-001",
  "attempt_index": 1,
  "T_start": "2026-04-15T06:27:26+00:00",
  "T_decision": "2026-04-15T06:27:27.400000+00:00",
  "T_exec": "2026-04-15T06:27:29.200000+00:00",
  "decision_latency_ms": 1400,
  "exec_latency_ms": 3200,
  "within_threshold": true
}
